{
  "schema": "otsec.config/0.1",
  "kind": "config.difference",
  "asset_id": "2b7d4e10-8c3f-4a5b-9e21-7c4f0d6a8b13",
  "rule": "sel-751-sho/1",
  "target": "simulated",
  "from": {
    "snapshot_digest": "sha256:df02865d95ef41c4488076925ee76517fb5a90ee9f2c580d53576362d33b5bee",
    "invocation_id": "8a2f6c41-5b7e-4d93-a0c2-1e9f3b7d6a51",
    "retrieved_at": "2026-10-27T09:10:06.0Z"
  },
  "to": {
    "snapshot_digest": "sha256:93823debc3783aeace620456a5efd6023d74a8adab6dc56f925a53f144a29260",
    "invocation_id": "8a2f6c41-5b7e-4d93-a0c2-1e9f3b7d6a52",
    "retrieved_at": "2026-10-27T09:20:06.0Z"
  },
  "changes": []
}
